{
  "build_runs": [
    {
      "case_results": [
        {
          "catalog_case_id": "RES-001",
          "label": "proposal_limit_ceiling_rejection",
          "status": "pass",
          "test_id": "P8-TEST-001"
        },
        {
          "catalog_case_id": "RES-001",
          "label": "effective_deadline_forwarded",
          "status": "pass",
          "test_id": "P8-TEST-002"
        },
        {
          "catalog_case_id": "RES-003",
          "label": "zero_depth_backpressure_and_retry_after_release",
          "status": "pass",
          "test_id": "P8-TEST-003"
        },
        {
          "catalog_case_id": "RES-003",
          "label": "concurrent_burst_admits_one_without_queue",
          "status": "pass",
          "test_id": "P8-TEST-004"
        },
        {
          "catalog_case_id": "ADM-007",
          "label": "cancellation_propagates_to_p4",
          "status": "pass",
          "test_id": "P8-TEST-005"
        },
        {
          "catalog_case_id": "ADM-007",
          "label": "caller_deadline_propagates_to_p4",
          "status": "pass",
          "test_id": "P8-TEST-006"
        },
        {
          "catalog_case_id": "STR-002",
          "label": "drain_close_waits_and_refuses_new_work",
          "status": "pass",
          "test_id": "P8-TEST-007"
        },
        {
          "catalog_case_id": "STR-002",
          "label": "cancel_close_stops_then_drains",
          "status": "pass",
          "test_id": "P8-TEST-008"
        },
        {
          "catalog_case_id": "STR-002",
          "label": "close_idempotence_terminal_state_and_new_instance",
          "status": "pass",
          "test_id": "P8-TEST-009"
        },
        {
          "catalog_case_id": "TEL-001",
          "label": "aggregate_snapshot_privacy_and_read_only_copy",
          "status": "pass",
          "test_id": "P8-TEST-010"
        },
        {
          "catalog_case_id": "STR-002",
          "label": "late_cancellation_is_ignored_and_slot_reusable",
          "status": "pass",
          "test_id": "P8-TEST-011"
        },
        {
          "catalog_case_id": "STR-002",
          "label": "destructor_requests_stop_without_use_after_free",
          "status": "pass",
          "test_id": "P8-TEST-012"
        }
      ],
      "compile_command": [
        "/usr/bin/x86_64-linux-gnu-g++-13",
        "-std=c++20",
        "-Wall",
        "-Wextra",
        "-Wpedantic",
        "-Wconversion",
        "-Wsign-conversion",
        "-Wshadow",
        "-Werror",
        "-O2",
        "-pthread",
        "/workspace/AGI-Core/Image/SPEC/p4/raster_admission.cpp",
        "/workspace/AGI-Core/Image/SPEC/p8/request_runtime.cpp",
        "/workspace/AGI-Core/Image/SPEC/harness/p8/test_request_runtime.cpp",
        "-o",
        "/tmp/image-vision-p8-9iziihgm/p8-normal"
      ],
      "compiler_output": "",
      "dynamic_link_dependencies": [
        "linux-vdso.so.1",
        "libstdc++.so.6",
        "libgcc_s.so.1",
        "libc.so.6",
        "libm.so.6",
        "/lib64/ld-linux-x86-64.so.2"
      ],
      "elapsed_ms": 56.256,
      "exit_code": 0,
      "mode": "normal",
      "status": "pass",
      "stderr": "",
      "stdout": "CASE\tP8-TEST-001\tpass\tRES-001\tproposal_limit_ceiling_rejection\nCASE\tP8-TEST-002\tpass\tRES-001\teffective_deadline_forwarded\nCASE\tP8-TEST-003\tpass\tRES-003\tzero_depth_backpressure_and_retry_after_release\nCASE\tP8-TEST-004\tpass\tRES-003\tconcurrent_burst_admits_one_without_queue\nCASE\tP8-TEST-005\tpass\tADM-007\tcancellation_propagates_to_p4\nCASE\tP8-TEST-006\tpass\tADM-007\tcaller_deadline_propagates_to_p4\nCASE\tP8-TEST-007\tpass\tSTR-002\tdrain_close_waits_and_refuses_new_work\nCASE\tP8-TEST-008\tpass\tSTR-002\tcancel_close_stops_then_drains\nCASE\tP8-TEST-009\tpass\tSTR-002\tclose_idempotence_terminal_state_and_new_instance\nCASE\tP8-TEST-010\tpass\tTEL-001\taggregate_snapshot_privacy_and_read_only_copy\nCASE\tP8-TEST-011\tpass\tSTR-002\tlate_cancellation_is_ignored_and_slot_reusable\nCASE\tP8-TEST-012\tpass\tSTR-002\tdestructor_requests_stop_without_use_after_free\nSUMMARY\t12\t12\n"
    },
    {
      "case_results": [
        {
          "catalog_case_id": "RES-001",
          "label": "proposal_limit_ceiling_rejection",
          "status": "pass",
          "test_id": "P8-TEST-001"
        },
        {
          "catalog_case_id": "RES-001",
          "label": "effective_deadline_forwarded",
          "status": "pass",
          "test_id": "P8-TEST-002"
        },
        {
          "catalog_case_id": "RES-003",
          "label": "zero_depth_backpressure_and_retry_after_release",
          "status": "pass",
          "test_id": "P8-TEST-003"
        },
        {
          "catalog_case_id": "RES-003",
          "label": "concurrent_burst_admits_one_without_queue",
          "status": "pass",
          "test_id": "P8-TEST-004"
        },
        {
          "catalog_case_id": "ADM-007",
          "label": "cancellation_propagates_to_p4",
          "status": "pass",
          "test_id": "P8-TEST-005"
        },
        {
          "catalog_case_id": "ADM-007",
          "label": "caller_deadline_propagates_to_p4",
          "status": "pass",
          "test_id": "P8-TEST-006"
        },
        {
          "catalog_case_id": "STR-002",
          "label": "drain_close_waits_and_refuses_new_work",
          "status": "pass",
          "test_id": "P8-TEST-007"
        },
        {
          "catalog_case_id": "STR-002",
          "label": "cancel_close_stops_then_drains",
          "status": "pass",
          "test_id": "P8-TEST-008"
        },
        {
          "catalog_case_id": "STR-002",
          "label": "close_idempotence_terminal_state_and_new_instance",
          "status": "pass",
          "test_id": "P8-TEST-009"
        },
        {
          "catalog_case_id": "TEL-001",
          "label": "aggregate_snapshot_privacy_and_read_only_copy",
          "status": "pass",
          "test_id": "P8-TEST-010"
        },
        {
          "catalog_case_id": "STR-002",
          "label": "late_cancellation_is_ignored_and_slot_reusable",
          "status": "pass",
          "test_id": "P8-TEST-011"
        },
        {
          "catalog_case_id": "STR-002",
          "label": "destructor_requests_stop_without_use_after_free",
          "status": "pass",
          "test_id": "P8-TEST-012"
        }
      ],
      "compile_command": [
        "/usr/bin/x86_64-linux-gnu-g++-13",
        "-std=c++20",
        "-Wall",
        "-Wextra",
        "-Wpedantic",
        "-Wconversion",
        "-Wsign-conversion",
        "-Wshadow",
        "-Werror",
        "-O2",
        "-pthread",
        "-fsanitize=address,undefined",
        "-fno-omit-frame-pointer",
        "-g",
        "/workspace/AGI-Core/Image/SPEC/p4/raster_admission.cpp",
        "/workspace/AGI-Core/Image/SPEC/p8/request_runtime.cpp",
        "/workspace/AGI-Core/Image/SPEC/harness/p8/test_request_runtime.cpp",
        "-o",
        "/tmp/image-vision-p8-9iziihgm/p8-address_undefined_sanitizers"
      ],
      "compiler_output": "",
      "dynamic_link_dependencies": [
        "linux-vdso.so.1",
        "libasan.so.8",
        "libstdc++.so.6",
        "libm.so.6",
        "libubsan.so.1",
        "libgcc_s.so.1",
        "libc.so.6",
        "/lib64/ld-linux-x86-64.so.2"
      ],
      "elapsed_ms": 70.838,
      "exit_code": 0,
      "mode": "address_undefined_sanitizers",
      "status": "pass",
      "stderr": "",
      "stdout": "CASE\tP8-TEST-001\tpass\tRES-001\tproposal_limit_ceiling_rejection\nCASE\tP8-TEST-002\tpass\tRES-001\teffective_deadline_forwarded\nCASE\tP8-TEST-003\tpass\tRES-003\tzero_depth_backpressure_and_retry_after_release\nCASE\tP8-TEST-004\tpass\tRES-003\tconcurrent_burst_admits_one_without_queue\nCASE\tP8-TEST-005\tpass\tADM-007\tcancellation_propagates_to_p4\nCASE\tP8-TEST-006\tpass\tADM-007\tcaller_deadline_propagates_to_p4\nCASE\tP8-TEST-007\tpass\tSTR-002\tdrain_close_waits_and_refuses_new_work\nCASE\tP8-TEST-008\tpass\tSTR-002\tcancel_close_stops_then_drains\nCASE\tP8-TEST-009\tpass\tSTR-002\tclose_idempotence_terminal_state_and_new_instance\nCASE\tP8-TEST-010\tpass\tTEL-001\taggregate_snapshot_privacy_and_read_only_copy\nCASE\tP8-TEST-011\tpass\tSTR-002\tlate_cancellation_is_ignored_and_slot_reusable\nCASE\tP8-TEST-012\tpass\tSTR-002\tdestructor_requests_stop_without_use_after_free\nSUMMARY\t12\t12\n"
    }
  ],
  "case_results": [
    {
      "catalog_case_id": "RES-001",
      "label": "proposal_limit_ceiling_rejection",
      "status": "pass",
      "test_id": "P8-TEST-001"
    },
    {
      "catalog_case_id": "RES-001",
      "label": "effective_deadline_forwarded",
      "status": "pass",
      "test_id": "P8-TEST-002"
    },
    {
      "catalog_case_id": "RES-003",
      "label": "zero_depth_backpressure_and_retry_after_release",
      "status": "pass",
      "test_id": "P8-TEST-003"
    },
    {
      "catalog_case_id": "RES-003",
      "label": "concurrent_burst_admits_one_without_queue",
      "status": "pass",
      "test_id": "P8-TEST-004"
    },
    {
      "catalog_case_id": "ADM-007",
      "label": "cancellation_propagates_to_p4",
      "status": "pass",
      "test_id": "P8-TEST-005"
    },
    {
      "catalog_case_id": "ADM-007",
      "label": "caller_deadline_propagates_to_p4",
      "status": "pass",
      "test_id": "P8-TEST-006"
    },
    {
      "catalog_case_id": "STR-002",
      "label": "drain_close_waits_and_refuses_new_work",
      "status": "pass",
      "test_id": "P8-TEST-007"
    },
    {
      "catalog_case_id": "STR-002",
      "label": "cancel_close_stops_then_drains",
      "status": "pass",
      "test_id": "P8-TEST-008"
    },
    {
      "catalog_case_id": "STR-002",
      "label": "close_idempotence_terminal_state_and_new_instance",
      "status": "pass",
      "test_id": "P8-TEST-009"
    },
    {
      "catalog_case_id": "TEL-001",
      "label": "aggregate_snapshot_privacy_and_read_only_copy",